<?xml version="1.0" encoding="UTF-8"?>
<CommitHookConfig xmlns="http://code.google.com/p/kickassalternate" xmlns:xsi="http://www.w3.org/2001/XMLSchema-instance" xsi:schemaLocation="http://code.google.com/p/kickassalternate ../xsd/config.xsd ">
  <Check className="com.ind.commithook.checkers.CommentChecker" legend="Comments Checker">
    <Parameters>
      <Parameter name="minLength" value="20"/>
      <Parameter name="pattern" value="JIRABUGID-\d*:.*"/>
    </Parameters>
    <Include>
      <RegexpPattern value=".*\.java"/>
    </Include>
    <Exclude>
      <RegexpPattern value=".*/test/.*\.java"/>
    </Exclude>
  </Check>
  <Check className="com.ind.commithook.checkers.CheckStyle" legend="Java CheckStyle General Checker">
    <Parameters>
      <Parameter name="configFile" value="D:\Eclipse\commithook\com.ind.commithook\samples\checkstyle.xml"/>
    </Parameters>
  </Check>
</CommitHookConfig>
